Ticket id,Interaction id,Interaction date,Mailbox,Ticket Summary,Interaction content,Innso TYPOLOGY_TICKET ,Type 1,Type 2,Type 3,Type 4,Unnamed: 11,y1,y2,y3,y4,x,y,ts_en,ts,ic
22983,64268,44805.45764,support.pt@aspiegel.com,RE : [AppGallery]Probleme și sugestii,"Stimate client, Vă mulțumim că ați contactat Aspiegel. Sperăm că vă simțiți bine. Acest e-mail este în legătură cu solicitarea dvs. privind problema AppGallery. Pentru a o putea investiga în continuare, vă rugăm să ne furnizați următoarele: 1. O descriere a problemei 2. O captură de ecran sau o înregistrare video a erorii 3. Momentul în care s-a produs problema 4. ID-ul dvs. Huawei: App Gallery>HMS core>Deschideți apoi faceți o captură de ecran 5. Modelul telefonului dvs. 6. Numărul SN al dispozitivului dvs. 7. Versiunea App Gallery: Huawei App Gallery>Me> About 8. HMS Core Version: Huawei App Gallery>HMS core>Deschideți>Setări>Despre 9. Aplicație aferentă 10. Versiunea aplicației aferente 11. Jurnal de aplicații Vă mulțumim pentru cooperare. Pentru întrebări suplimentare, vă rugăm să nu ezitați să răspundeți la acest mesaj și vom fi bucuroși să vă ajutăm să vă clarificați nelămuririle. Cu stimă, Stela Echipa de asistență pentru clienți Aspiegel A Aspiegel SE é uma empresa constituída segundo as leis da Irlanda, com sede em Dublin, Irlanda. Aspiegel SE é o provedor de Huawei Mobile Services para Huawei e Honor proprietários de dispositivos na Europa, Canadá, Austrália, Nova Zelândia e outros países. From : xxxxx@xxxx.com Sent : Thursday 01 September *****(PHONE) 11:41 To : xxxxx@xxxx.com Subject : [AppGallery]Probleme și sugestii Descriere Nu se instalează Informații contact *****(PHONE) Trimis de pe telefonul meu Huawei",AppGallery / Other Requests,AppGallery ,Others,,,,AppGallery ,Others,,,"Stimate client, Vă mulțumim că ați contactat Aspiegel. Sperăm că vă simțiți bine. Acest e-mail este în legătură cu solicitarea dvs. privind problema AppGallery. Pentru a o putea investiga în continuare, vă rugăm să ne furnizați următoarele: 1. O descriere a problemei 2. O captură de ecran sau o înregistrare video a erorii 3. Momentul în care s-a produs problema 4. ID-ul dvs. Huawei: App Gallery>HMS core>Deschideți apoi faceți o captură de ecran 5. Modelul telefonului dvs. 6. Numărul SN al dispozitivului dvs. 7. Versiunea App Gallery: Huawei App Gallery>Me> About 8. HMS Core Version: Huawei App Gallery>HMS core>Deschideți>Setări>Despre 9. Aplicație aferentă 10. Versiunea aplicației aferente 11. Jurnal de aplicații Vă mulțumim pentru cooperare. Pentru întrebări suplimentare, vă rugăm să nu ezitați să răspundeți la acest mesaj și vom fi bucuroși să vă ajutăm să vă clarificați nelămuririle. Cu stimă, Stela Echipa de asistență pentru clienți Aspiegel A Aspiegel SE é uma empresa constituída segundo as leis da Irlanda, com sede em Dublin, Irlanda. Aspiegel SE é o provedor de Huawei Mobile Services para Huawei e Honor proprietários de dispositivos na Europa, Canadá, Austrália, Nova Zelândia e outros países. From : xxxxx@xxxx.com Sent : Thursday 01 September *****(PHONE) 11:41 To : xxxxx@xxxx.com Subject : [AppGallery]Probleme și sugestii Descriere Nu se instalează Informații contact *****(PHONE) Trimis de pe telefonul meu Huawei",Others,RE : [AppGallery]Problems and suggestions,appgallery probleme și sugestii,stimate client mul umim a contactat aspiegel sper c sim i bine acest mail este leg tur cu solicitarea dvs privind problema appgallery pentru o putea investiga continuare rug s ne furniza urm toarele descriere problemei captur de ecran sau nregistrare video erorii momentul care a produs problema id ul dvs huawei app gallery hms core deschide apoi face o captur de ecran modelul telefonului dvs num rul sn al dispozitivului dvs versiunea app gallery huawei app gallery me about hms core version huawei app gallery hms core deschide set ri despre aplica ie aferent versiunea aplica iei aferente jurnal de aplica ii mul umim pentru cooperare pentru ntreb ri suplimentare rug s nu ezita s spunde la acest mesaj vom fi bucuro s ajut s clarifica nel muririle cu stim stela echipa de asisten pentru clien aspiegel aspiegel se uma empresa constitu da segundo as leis da irlanda com sede em dublin irlanda aspiegel se provedor de huawei mobile services para huawei honor propriet rios de dispositivos na europa canad austr lia zel ndia outros pa ses to appgallery probleme sugestii descriere nu se instaleaz informa ii contact trimis de pe telefonul meu huawei
22982,64259,44805.44514,support.pt@aspiegel.com,Problems and suggestions متجر التطبيقات]المشاكل والاقتراحات,التفاصيل نقل الصادرة. الواردة معلومات التواصل *****(PHONE),AppGallery / Suggestions &amp; Feedback,AppGallery ,Others,,,,AppGallery ,Others,,,التفاصيل نقل الصادرة. الواردة معلومات التواصل *****(PHONE),Others,Problems and suggestions App Store]Problems and suggestions,problems and suggestions متجر التطبيقات المشاكل والاقتراحات,
22980,64253,44805.44097,support.eu@aspiegel.com,Aspiegel Support issue submit,"Product: Other products Requests: Requests Contact Full Name: Aust horst Phone Number: +*****(PHONE) Contact Email Address: xxxxx@xxxx.com Summary of the issue: Deutsch bitte Ich habe bei der Gamescom Halle 7 appgaliere, Glücksrad die watch GT3 gewonnen. Ich habe keine weiteren Dokumente erhalten das diese offiziell in meinem Besitz ist.wo bekomme ich das her Home | News | Events | Products | Partners | Support Copyright Aspiegel SE",AppGallery / Unable to claim the prize/points/coupons,AppGallery ,Others,,,,AppGallery ,Others,,,"Product: Other products Requests: Requests Contact Full Name: Aust horst Phone Number: +*****(PHONE) Contact Email Address: xxxxx@xxxx.com Summary of the issue: Deutsch bitte Ich habe bei der Gamescom Halle 7 appgaliere, Glücksrad die watch GT3 gewonnen. Ich habe keine weiteren Dokumente erhalten das diese offiziell in meinem Besitz ist.wo bekomme ich das her Home | News | Events | Products | Partners | Support Copyright Aspiegel SE",Others,Aspiegel Support issue submit,,product other products requests requests contact full name aust horst phone numbe contact email address sum of the issue deutsch bitte ich habe bei der gamescom halle appgaliere gl cksrad die watch gt gewonnen ich habe keine weiteren dokumente erhalten das diese offiziell in meinem besitz ist wo bekomme ich das her home news events products partners support copyright aspiegel se
22980,64265,44805.45486,support.de@aspiegel.com,GT3,"Sehr geehrter Herrn *****(PER), Wir empfehlen Ihnen, uns über den Discord-Kanal https://discord.gg/daCXQNc4QF direkt von Ihrem Computer aus zu kontaktieren. Wenn Sie Schwierigkeiten bei der Nutzung von Discord haben oder es vorziehen, dass wir den Fall bearbeiten, geben Sie uns bitte folgende Informationen für weitere Untersuchungen: 1. Ihre Huawei-ID 2. Ihr Dienstland AppGallery> Ich> Einstellungen> Land 2. Der Name der Spiele-App 3. Der Name der Kampagne, an der Sie teilgenommen haben 4. Geben Sie an, wie viele HUAWEI-Punkte/Gutscheine/Prämien Sie erhalten sollten 5. Ihre Discord-Kontaktinformationen, falls zutreffend Wenn Sie weitere Fragen haben, antworten Sie bitte auf diesen E-Mail-Thread und wir helfen Ihnen gerne bei Ihren Zweifeln weiter. Mit freundlichen Grüßen, *****(PER) Kundenservice Die Aspiegel SE ist eine Gesellschaft nach irischem Recht mit Sitz in *****(LOC), *****(LOC). Aspiegel SE ist der Anbieter von Huawei Mobile Services für Huawei- und Honor-Gerätebesitzer in *****(LOC), *****(LOC), *****(LOC), *****(LOC) und anderen Ländern. From : xxxxx@xxxx.com Sent : Thursday 01 September *****(PHONE) 11:35 To : xxxxx@xxxx.com Subject : Aspiegel Support issue submit Product: Other products Requests: Requests Contact Full Name: Aust horst Phone Number: +*****(PHONE) Contact Email Address: xxxxx@xxxx.com Summary of the issue: Deutsch bitte Ich habe bei der Gamescom Halle 7 appgaliere, Glücksrad die watch GT3 gewonnen. Ich habe keine weiteren Dokumente erhalten das diese offiziell in meinem Besitz ist.wo bekomme ich das her Home | News | Events | Products | Partners | Support Copyright Aspiegel SE",AppGallery / Unable to claim the prize/points/coupons,AppGallery ,Others,,,,AppGallery ,Others,,,"Sehr geehrter Herrn *****(PER), Wir empfehlen Ihnen, uns über den Discord-Kanal https://discord.gg/daCXQNc4QF direkt von Ihrem Computer aus zu kontaktieren. Wenn Sie Schwierigkeiten bei der Nutzung von Discord haben oder es vorziehen, dass wir den Fall bearbeiten, geben Sie uns bitte folgende Informationen für weitere Untersuchungen: 1. Ihre Huawei-ID 2. Ihr Dienstland AppGallery> Ich> Einstellungen> Land 2. Der Name der Spiele-App 3. Der Name der Kampagne, an der Sie teilgenommen haben 4. Geben Sie an, wie viele HUAWEI-Punkte/Gutscheine/Prämien Sie erhalten sollten 5. Ihre Discord-Kontaktinformationen, falls zutreffend Wenn Sie weitere Fragen haben, antworten Sie bitte auf diesen E-Mail-Thread und wir helfen Ihnen gerne bei Ihren Zweifeln weiter. Mit freundlichen Grüßen, *****(PER) Kundenservice Die Aspiegel SE ist eine Gesellschaft nach irischem Recht mit Sitz in *****(LOC), *****(LOC). Aspiegel SE ist der Anbieter von Huawei Mobile Services für Huawei- und Honor-Gerätebesitzer in *****(LOC), *****(LOC), *****(LOC), *****(LOC) und anderen Ländern. From : xxxxx@xxxx.com Sent : Thursday 01 September *****(PHONE) 11:35 To : xxxxx@xxxx.com Subject : Aspiegel Support issue submit Product: Other products Requests: Requests Contact Full Name: Aust horst Phone Number: +*****(PHONE) Contact Email Address: xxxxx@xxxx.com Summary of the issue: Deutsch bitte Ich habe bei der Gamescom Halle 7 appgaliere, Glücksrad die watch GT3 gewonnen. Ich habe keine weiteren Dokumente erhalten das diese offiziell in meinem Besitz ist.wo bekomme ich das her Home | News | Events | Products | Partners | Support Copyright Aspiegel SE",Others,by GT3,gt3,sehr geehrter herrn wir empfehlen ihnen uns ber den discord kanal https discord gg dacxqnc qf direkt von ihrem computer aus zu kontaktieren wenn sie schwierigkeiten bei der nutzung von discord haben oder es vorziehen dass wir den fall bearbeiten geben sie uns bitte folgende informationen r weitere untersuchungen ihre huawei id ihr dienstland appgallery ich einstellungen land der name der spiele app der name der kampagne an der sie teilgenommen haben geben sie an wie viele huawei punkte gutscheine pr mien sie erhalten sollten ihre discord kontaktinformationen falls zutreffend wenn sie weitere fragen haben antworten sie bitte auf diesen mail thread und wir helfen ihnen gerne bei ihren zweifeln weiter mit freundlichen gr en kundenservice die aspiegel se ist eine gesellschaft nach irischem recht mit sitz in aspiegel se ist der anbieter von huawei mobile services r huawei und honor ger tebesitzer in und anderen ndern to aspiegel support issue submit product other products requests requests contact full name aust horst phone numbe contact email address sum of the issue deutsch bitte ich habe bei der gamescom halle appgaliere gl cksrad die watch gt gewonnen ich habe keine weiteren dokumente erhalten das diese offiziell in meinem besitz ist wo bekomme ich das her home news events products partners support copyright aspiegel se
22980,64271,44805.46597,support.de@aspiegel.com,Re: GT3,"Es tut mir leid discord habe ich nicht und werde ich auch nicht nutzen. Ich komme aus *****(LOC) Nutze das mate 10 pro. Die Huawei ID: xxxxx@xxxx.com Ich habe keine App die zu erwähnen ist. Die Action lief am 25.8.22 in der Halle 7 Stand,, appgalerie ,, ab 14:00 auf der Gamescom.(siehe Fotos) Meine Frage nochmal : wo bekomme ich die schriftliche (Ausdruck reicht via Mail) Bestätigung das die watch GT3 mein Eigentum ist her. Auf der Gamescom gab es diesbezüglich nichts an die Hand. Mfg *****(PER) Aprikosenstr.6 *****(PHONE) Meckenheim *****(LOC) schrieb am Do., 1. Sept. *****(PHONE), 11:55: Sehr geehrter Herrn *****(PER), Wir empfehlen Ihnen, uns über den Discord-Kanal https://discord.gg/daCXQNc4QF direkt von Ihrem Computer aus zu kontaktieren. Wenn Sie Schwierigkeiten bei der Nutzung von Discord haben oder es vorziehen, dass wir den Fall bearbeiten, geben Sie uns bitte folgende Informationen für weitere Untersuchungen: 1. Ihre Huawei-ID 2. Ihr Dienstland AppGallery> Ich> Einstellungen> Land 2. Der Name der Spiele-App 3. Der Name der Kampagne, an der Sie teilgenommen haben 4. Geben Sie an, wie viele HUAWEI-Punkte/Gutscheine/Prämien Sie erhalten sollten 5. Ihre Discord-Kontaktinformationen, falls zutreffend Wenn Sie weitere Fragen haben, antworten Sie bitte auf diesen E-Mail-Thread und wir helfen Ihnen gerne bei Ihren Zweifeln weiter. Mit freundlichen Grüßen, *****(PER) Kundenservice Die Aspiegel SE ist eine Gesellschaft nach irischem Recht mit Sitz in *****(LOC), *****(LOC). Aspiegel SE ist der Anbieter von Huawei Mobile Services für Huawei- und Honor-Gerätebesitzer in *****(LOC), *****(LOC), *****(LOC), *****(LOC) und anderen Ländern. From : xxxxx@xxxx.com Sent : Thursday 01 September *****(PHONE) 11:35 To : xxxxx@xxxx.com Subject : Aspiegel Support issue submit Product: Other products Requests: Requests Contact Full Name: Aust horst Phone Number: +*****(PHONE) Contact Email Address: xxxxx@xxxx.com Summary of the issue: Deutsch bitte Ich habe bei der Gamescom Halle 7 appgaliere, Glücksrad die watch GT3 gewonnen. Ich habe keine weiteren Dokumente erhalten das diese offiziell in meinem Besitz ist.wo bekomme ich das her Home | News | Events | Products | Partners | Support Copyright Aspiegel SE *****(PHONE)",AppGallery / Unable to claim the prize/points/coupons,AppGallery ,Others,,,,AppGallery ,Others,,,"Es tut mir leid discord habe ich nicht und werde ich auch nicht nutzen. Ich komme aus *****(LOC) Nutze das mate 10 pro. Die Huawei ID: xxxxx@xxxx.com Ich habe keine App die zu erwähnen ist. Die Action lief am 25.8.22 in der Halle 7 Stand,, appgalerie ,, ab 14:00 auf der Gamescom.(siehe Fotos) Meine Frage nochmal : wo bekomme ich die schriftliche (Ausdruck reicht via Mail) Bestätigung das die watch GT3 mein Eigentum ist her. Auf der Gamescom gab es diesbezüglich nichts an die Hand. Mfg *****(PER) Aprikosenstr.6 *****(PHONE) Meckenheim *****(LOC) schrieb am Do., 1. Sept. *****(PHONE), 11:55: Sehr geehrter Herrn *****(PER), Wir empfehlen Ihnen, uns über den Discord-Kanal https://discord.gg/daCXQNc4QF direkt von Ihrem Computer aus zu kontaktieren. Wenn Sie Schwierigkeiten bei der Nutzung von Discord haben oder es vorziehen, dass wir den Fall bearbeiten, geben Sie uns bitte folgende Informationen für weitere Untersuchungen: 1. Ihre Huawei-ID 2. Ihr Dienstland AppGallery> Ich> Einstellungen> Land 2. Der Name der Spiele-App 3. Der Name der Kampagne, an der Sie teilgenommen haben 4. Geben Sie an, wie viele HUAWEI-Punkte/Gutscheine/Prämien Sie erhalten sollten 5. Ihre Discord-Kontaktinformationen, falls zutreffend Wenn Sie weitere Fragen haben, antworten Sie bitte auf diesen E-Mail-Thread und wir helfen Ihnen gerne bei Ihren Zweifeln weiter. Mit freundlichen Grüßen, *****(PER) Kundenservice Die Aspiegel SE ist eine Gesellschaft nach irischem Recht mit Sitz in *****(LOC), *****(LOC). Aspiegel SE ist der Anbieter von Huawei Mobile Services für Huawei- und Honor-Gerätebesitzer in *****(LOC), *****(LOC), *****(LOC), *****(LOC) und anderen Ländern. From : xxxxx@xxxx.com Sent : Thursday 01 September *****(PHONE) 11:35 To : xxxxx@xxxx.com Subject : Aspiegel Support issue submit Product: Other products Requests: Requests Contact Full Name: Aust horst Phone Number: +*****(PHONE) Contact Email Address: xxxxx@xxxx.com Summary of the issue: Deutsch bitte Ich habe bei der Gamescom Halle 7 appgaliere, Glücksrad die watch GT3 gewonnen. Ich habe keine weiteren Dokumente erhalten das diese offiziell in meinem Besitz ist.wo bekomme ich das her Home | News | Events | Products | Partners | Support Copyright Aspiegel SE *****(PHONE)",Others,by: GT3,gt3,es tut mir leid discord habe ich nicht und werde ich auch nicht nutzen ich komme aus nutze das mate pro die huawei id ich habe keine app die zu erw hnen ist die action lief am in der halle stand appgalerie ab auf der gamescom siehe fotos meine frage nochmal wo bekomme ich die schriftliche ausdruck reicht via mail best tigung das die watch gt mein eigentum ist her auf der gamescom gab es diesbez glich nichts an die hand mfg ikosenstr meckenheim schrieb am do sehr geehrter herrn wir empfehlen ihnen uns ber den discord kanal https discord gg dacxqnc qf direkt von ihrem computer aus zu kontaktieren wenn sie schwierigkeiten bei der nutzung von discord haben oder es vorziehen dass wir den fall bearbeiten geben sie uns bitte folgende informationen r weitere untersuchungen ihre huawei id ihr dienstland appgallery ich einstellungen land der name der spiele app der name der kampagne an der sie teilgenommen haben geben sie an wie viele huawei punkte gutscheine pr mien sie erhalten sollten ihre discord kontaktinformationen falls zutreffend wenn sie weitere fragen haben antworten sie bitte auf diesen mail thread und wir helfen ihnen gerne bei ihren zweifeln weiter mit freundlichen gr en kundenservice die aspiegel se ist eine gesellschaft nach irischem recht mit sitz in aspiegel se ist der anbieter von huawei mobile services r huawei und honor ger tebesitzer in und anderen ndern to aspiegel support issue submit product other products requests requests contact full name aust horst phone numbe contact email address sum of the issue deutsch bitte ich habe bei der gamescom halle appgaliere gl cksrad die watch gt gewonnen ich habe keine weiteren dokumente erhalten das diese offiziell in meinem besitz ist wo bekomme ich das her home news events products partners support copyright aspiegel se
