Ticket id,Interaction id,Interaction date,Mailbox,Ticket Summary,Interaction content,Innso TYPOLOGY_TICKET ,Type 1,Type 2,Type 3,Type 4,Unnamed: 11,y1,y2,y3,y4,x,y,ts_en,ts,ic
24310,68365,,support.eu@aspiegel.com,[HUAWEI Music] Problems and Suggestions,Mxxxxx@xxxx.com Отправлено с моего телефона Huawei,AppGallery / Other Requests,AppGallery ,Others,,,,AppGallery ,Others,,,Mxxxxx@xxxx.com Отправлено с моего телефона Huawei,Others,[HUAWEI Music] Problems and Suggestions,huawei music problems and suggestions,huawei
24075,67730,,support.pt@aspiegel.com,[AppGallery]Probleme und Vorschläge,Beschreibung Update lässt sich nicht installieren Kontaktinformationen Sxxxxx@xxxx.comDescription Update cannot be installed Contact information Sxxxxx@xxxx.com Description Update cannot be installed Contact information Sxxxxx@xxxx.comDescription Update cannot be installed Contact information Sxxxxx@xxxx.com,AppGallery / Suggestions &amp; Feedback,AppGallery ,Problem/Fault,AppGallery-Install/Upgrade,Can't update Apps,,AppGallery ,Problem/Fault,AppGallery-Install/Upgrade,Can't update Apps,Beschreibung Update lässt sich nicht installieren Kontaktinformationen Sxxxxx@xxxx.comDescription Update cannot be installed Contact information Sxxxxx@xxxx.com Description Update cannot be installed Contact information Sxxxxx@xxxx.comDescription Update cannot be installed Contact information Sxxxxx@xxxx.com,Problem/Fault,[AppGallery] Problems and suggestions,appgallery probleme und vorschläge,beschreibung update sst sich nicht installieren kontaktinformationen description update cannot be installed contact information description update cannot be installed contact information description update cannot be installed contact information
24075,67762,,support.pt@aspiegel.com,Re: RE : [AppGallery]Probleme und Vorschläge Re: RE : [AppGallery]Problems and Suggestions,"Danke Nach Neuinstallation der App funktioniert alles einwandfrei MfG *****(PER) schrieb am Do., 8. Sep. *****(PHONE), 20:42: Sehr geehrter Kunde, vielen Dank, dass Sie mit Aspiegel Kontakt aufgenommen haben. Wir hoffen, dass es Ihnen gut geht. Um Ihnen die beste Lösung anbieten zu können, bitten wir Sie, Ihre Anfrage mit den folgenden Informationen zu präzisieren: 1. Eine Beschreibung des Problems 2. Ein Screenshot oder eine Videoaufnahme des Fehlers 3. Wann das Problem aufgetreten ist 4. Ihre Huawei-ID: App Gallery>HMS core>Öffnen und dann einen Screenshot machen 5. Ihr Handymodell 6. SN-Nummer Ihres Geräts 7. Version der App-Galerie: Huawei App-Galerie>Mich> Über 8. HMS Core Version: Huawei App-Galerie>HMS-Kern>Öffnen> Einstellungen> Über 9. Verwandte App 10. Version der verwandten App 11. Das Protokoll der App-Galerie Wenn Sie weitere Fragen haben, antworten Sie bitte auf diesen E-Mail-Thread und wir werden Ihnen gerne weiterhelfen. Mit freundlichen Grüßen, *****(PER) Customer Support team A Aspiegel SE é uma empresa constituída segundo as leis da *****(LOC), com sede em Dublin, *****(LOC). Aspiegel SE é o provedor de Huawei Mobile Services para Huawei e Honor proprietários de dispositivos na Europa, Canadá, Austrália, Nova Zelândia e outros países. From : xxxxx@xxxx.com Sent : Thursday 08 September *****(PHONE) 20:07 To : xxxxx@xxxx.com Subject : [AppGallery]Probleme und Vorschläge Beschreibung Update lässt sich nicht installieren Kontaktinformationen Sxxxxx@xxxx.com *****(PHONE)",AppGallery / Suggestions &amp; Feedback,AppGallery ,Problem/Fault,AppGallery-Install/Upgrade,Can't update Apps,,AppGallery ,Problem/Fault,AppGallery-Install/Upgrade,Can't update Apps,"Danke Nach Neuinstallation der App funktioniert alles einwandfrei MfG *****(PER) schrieb am Do., 8. Sep. *****(PHONE), 20:42: Sehr geehrter Kunde, vielen Dank, dass Sie mit Aspiegel Kontakt aufgenommen haben. Wir hoffen, dass es Ihnen gut geht. Um Ihnen die beste Lösung anbieten zu können, bitten wir Sie, Ihre Anfrage mit den folgenden Informationen zu präzisieren: 1. Eine Beschreibung des Problems 2. Ein Screenshot oder eine Videoaufnahme des Fehlers 3. Wann das Problem aufgetreten ist 4. Ihre Huawei-ID: App Gallery>HMS core>Öffnen und dann einen Screenshot machen 5. Ihr Handymodell 6. SN-Nummer Ihres Geräts 7. Version der App-Galerie: Huawei App-Galerie>Mich> Über 8. HMS Core Version: Huawei App-Galerie>HMS-Kern>Öffnen> Einstellungen> Über 9. Verwandte App 10. Version der verwandten App 11. Das Protokoll der App-Galerie Wenn Sie weitere Fragen haben, antworten Sie bitte auf diesen E-Mail-Thread und wir werden Ihnen gerne weiterhelfen. Mit freundlichen Grüßen, *****(PER) Customer Support team A Aspiegel SE é uma empresa constituída segundo as leis da *****(LOC), com sede em Dublin, *****(LOC). Aspiegel SE é o provedor de Huawei Mobile Services para Huawei e Honor proprietários de dispositivos na Europa, Canadá, Austrália, Nova Zelândia e outros países. From : xxxxx@xxxx.com Sent : Thursday 08 September *****(PHONE) 20:07 To : xxxxx@xxxx.com Subject : [AppGallery]Probleme und Vorschläge Beschreibung Update lässt sich nicht installieren Kontaktinformationen Sxxxxx@xxxx.com *****(PHONE)",Problem/Fault,Re: RE : [AppGallery]Problems and suggestions Re: RE : [AppGallery]Problems and suggestions,appgallery probleme und vorschläge appgallery problems and suggestions,danke nach neuinstallation der app funktioniert alles einwandfrei mfg schrieb am do sehr geehrter kunde vielen dank dass sie mit aspiegel kontakt aufgenommen haben wir hoffen dass es ihnen gut geht um ihnen die beste sung anbieten zu nnen bitten wir sie ihre anfrage mit den folgenden informationen zu pr zisieren eine beschreibung des problems ein screenshot oder eine videoaufnahme des fehlers wann das problem aufgetreten ist ihre huawei id app gallery hms core ffnen und dann einen screenshot machen ihr handymodell sn nummer ihres ger ts version der app galerie huawei app galerie mich ber hms core version huawei app galerie hms kern ffnen einstellungen ber verwandte app version der verwandten app das protokoll der app galerie wenn sie weitere fragen haben antworten sie bitte auf diesen mail thread und wir werden ihnen gerne weiterhelfen mit freundlichen gr en aspiegel se uma empresa constitu da segundo as leis da com sede em dublin aspiegel se provedor de huawei mobile services para huawei honor propriet rios de dispositivos na europa canad austr lia zel ndia outros pa ses to appgallery probleme und vorschl ge beschreibung update sst sich nicht installieren kontaktinformationen
23748,66706,,support.pt@aspiegel.com,[AppGallery]Problems and suggestions,Description . Contact information Axxxxx@xxxx.com,AppGallery / Other Requests,AppGallery ,Suggestion,AppGallery-Use,Others,,AppGallery ,Suggestion,AppGallery-Use,Others,Description . Contact information Axxxxx@xxxx.com,Suggestion,[AppGallery]Problems and suggestions,appgallery problems and suggestions,description contact information
23740,66684,,support.eu@aspiegel.com,nan,Ho pagato ma l'applicazione non ha funzionato posso essere rimborsata. Grazie Ho I paid but the application did not work can I be refunded. Thank you,AppGallery / Refund request : app/item purchased not working as expected ,AppGallery ,Problem/Fault,Third Party APPs,Refund,,AppGallery ,Problem/Fault,Third Party APPs,Refund,Ho pagato ma l'applicazione non ha funzionato posso essere rimborsata. Grazie Ho I paid but the application did not work can I be refunded. Thank you,Problem/Fault,Issue,,ho pagato ma applicazione non ha funzionato posso essere rimborsata grazie ho paid but the application did not work can be refunded
23683,66429,,support.eu@aspiegel.com,Aspiegel Support issue submit,"Product: AppGallery & Games Requests: Using AppGallery (i.e. manage service country) Contact Full Name: Inês Lavrador Ramos Phone Number: +*****(PHONE) Contact Email Address: xxxxx@xxxx.com Summary of the issue: Good morning! I would like to know how I can use a voucher that I won on app gallery since the store now was put together with other store, and I still have the voucher to use! thanks in advance! Home | News | Events | Products | Partners | Support Copyright Aspiegel SE","AppGallery /  Information request (e.g. prize delivery timeframe, how to join campaign)",AppGallery ,Suggestion,VIP / Offers / Promotions,Offers / Vouchers / Promotions,,AppGallery ,Suggestion,VIP / Offers / Promotions,Offers / Vouchers / Promotions,"Product: AppGallery & Games Requests: Using AppGallery (i.e. manage service country) Contact Full Name: Inês Lavrador Ramos Phone Number: +*****(PHONE) Contact Email Address: xxxxx@xxxx.com Summary of the issue: Good morning! I would like to know how I can use a voucher that I won on app gallery since the store now was put together with other store, and I still have the voucher to use! thanks in advance! Home | News | Events | Products | Partners | Support Copyright Aspiegel SE",Suggestion,Aspiegel Support issue submit,,product appgallery games requests using appgallery e manage service country contact full name in lavrador ramos phone numbe contact email address sum of the issue would like to know how can use voucher that won on app gallery since the store now was put together with other store and still have the voucher to use thanks in advance home news events products partners support copyright aspiegel se
23683,67433,,support.eu@aspiegel.com,Re: RE : Aspiegel Support issue submit,"Hello , good morning! So the campaign name was ""XMAS download and win play PT"" as you will see in the screenshot I will send you, and I won a voucher to use it in a online store called ""*****(PERSON)"" but now ""*****(PERSON)"" is a part of other company/store called ""*****(PERSON)"" And what's my Huawei I'd service country? Thanks in advance! A ter, 6 de set de *****(PHONE), 12:16, escreveu: Dear Customer, Thank you for contacting *****(PERSON). We hope you’re doing well. This email is regarding your concern about *****(PERSON) worry I will do my best to solve your problem as soon as possible. In order to analyze your case in detail I will need the following information from you: Error screenshot The name of the champagne you have attended Your Huawei Id Service country We would greatly appreciate your feedback regarding our email exchange, as we need your input to keep improving our service. Therefore, we invite you to fill in the survey that will soon arrive on the email address you used to contact us. If you have any further questions, please feel free to reply to this email thread and we will be happy to walk you through your doubts. Sincerely, Silvia *****(PERSON) Customer Support team *****(PERSON) SE is a company incorporated under the laws of Ireland with its headquarters in Dublin, Ireland. *****(PERSON) SE is the provider of Huawei Mobile Services to Huawei and Honor device owners in *****(LOC), Canada, Australia, New Zealand and other countries. From : xxxxx@xxxx.com Sent : Tuesday 06 September *****(PHONE) 12:17 To : xxxxx@xxxx.com Subject : *****(PERSON) Support issue submit Product: AppGallery & Games Requests: Using AppGallery (i.e. manage service country) Contact Full Name: Inês Lavrador Ramos Phone Number: +*****(PHONE) Contact Email Address: xxxxx@xxxx.com Summary of the issue: Good morning! I would like to know how I can use a voucher that I won on app gallery since the store now was put together with other store, and I still have the voucher to use! thanks in advance! Home | News | Events | Products | Partners | Support Copyright *****(PERSON) SE *****(PHONE)","AppGallery /  Information request (e.g. prize delivery timeframe, how to join campaign)",AppGallery ,Suggestion,VIP / Offers / Promotions,Offers / Vouchers / Promotions,,AppGallery ,Suggestion,VIP / Offers / Promotions,Offers / Vouchers / Promotions,"Hello , good morning! So the campaign name was ""XMAS download and win play PT"" as you will see in the screenshot I will send you, and I won a voucher to use it in a online store called ""*****(PERSON)"" but now ""*****(PERSON)"" is a part of other company/store called ""*****(PERSON)"" And what's my Huawei I'd service country? Thanks in advance! A ter, 6 de set de *****(PHONE), 12:16, escreveu: Dear Customer, Thank you for contacting *****(PERSON). We hope you’re doing well. This email is regarding your concern about *****(PERSON) worry I will do my best to solve your problem as soon as possible. In order to analyze your case in detail I will need the following information from you: Error screenshot The name of the champagne you have attended Your Huawei Id Service country We would greatly appreciate your feedback regarding our email exchange, as we need your input to keep improving our service. Therefore, we invite you to fill in the survey that will soon arrive on the email address you used to contact us. If you have any further questions, please feel free to reply to this email thread and we will be happy to walk you through your doubts. Sincerely, Silvia *****(PERSON) Customer Support team *****(PERSON) SE is a company incorporated under the laws of Ireland with its headquarters in Dublin, Ireland. *****(PERSON) SE is the provider of Huawei Mobile Services to Huawei and Honor device owners in *****(LOC), Canada, Australia, New Zealand and other countries. From : xxxxx@xxxx.com Sent : Tuesday 06 September *****(PHONE) 12:17 To : xxxxx@xxxx.com Subject : *****(PERSON) Support issue submit Product: AppGallery & Games Requests: Using AppGallery (i.e. manage service country) Contact Full Name: Inês Lavrador Ramos Phone Number: +*****(PHONE) Contact Email Address: xxxxx@xxxx.com Summary of the issue: Good morning! I would like to know how I can use a voucher that I won on app gallery since the store now was put together with other store, and I still have the voucher to use! thanks in advance! Home | News | Events | Products | Partners | Support Copyright *****(PERSON) SE *****(PHONE)",Suggestion,Re: RE : Aspiegel Support issue submit,,so the campaign name was xmas download and win play pt as you will see in the screenshot will send you and won voucher to use it in online store called but now is part of other company store called and what my huawei d service country thanks in advance ter de set de escreveu we hope you re doing well this email is regarding your concern about worry will do my best to solve your problem as soon as possible in order to analyze your case in detail will need the following information from you error screenshot the name of the champagne you have attended your huawei id service country we would greatly appreciate your feedback regarding our email exchange as we need your input to keep improving our service therefore we invite you to fill in the survey that will soon arrive on the email address you used to contact us if you have any further questions please feel free to reply to this email thread and we will be happy to walk you through your doubts sincerely silvia to support issue submit product appgallery games requests using appgallery e manage service country contact full name in lavrador ramos phone numbe contact email address sum of the issue would like to know how can use voucher that won on app gallery since the store now was put together with other store and still have the voucher to use thanks in advance home news events products partners support copyright se
23683,67516,,support.eu@aspiegel.com,Re: RE : Aspiegel Support issue submit,"I have to an account there? also I don't speak german! escreveu no dia quinta, 8/09/*****(PHONE) à(s) 12:08: Sehr geehrter Kunde, wir empfehlen Ihnen, uns über den Discord-Kanal https://discord.gg/tkYZC5CAGu direkt von Ihrem Computer aus zu kontaktieren. *****(PERSON) haben, Discord zu benutzen, oder wenn Sie es vorziehen, dass wir den Fall bearbeiten, geben Sie uns bitte folgende Informationen für weitere Untersuchungen: - Ihr Dienstland AppGallery> Ich> Einstellungen> Land - Ihre Discord-Kontaktinformationen, falls zutreffend Wenn Sie weitere Fragen haben, antworten Sie bitte auf diesen e-Mail und wir helfen Ihnen gerne bei Ihren Zweifeln weiter. *****(PERSON), Andrea *****(PERSON) Customer Support team *****(PERSON) SE is a company incorporated under the laws of Ireland with its headquarters in Dublin, Ireland. *****(PERSON) SE is the provider of Huawei Mobile Services to Huawei and Honor device owners in *****(LOC), Canada, Australia, New Zealand and other countries. From : xxxxx@xxxx.com Sent : Thursday 08 September *****(PHONE) 12:20 To : xxxxx@xxxx.com Subject : Re: RE : *****(PERSON) Support issue submit Hello , good morning! So the campaign name was ""XMAS download and win play PT"" as you will see in the screenshot I will send you, and I won a voucher to use it in a online store called ""*****(PERSON)"" but now ""*****(PERSON)"" is a part of other company/store called ""*****(PERSON)"" And what's my Huawei I'd service country? Thanks in advance! A ter, 6 de set de *****(PHONE), 12:16, < xxxxx@xxxx.com> escreveu: Dear Customer, Thank you for contacting *****(PERSON). We hope you’re doing well. This email is regarding your concern about *****(PERSON) worry I will do my best to solve your problem as soon as possible. In order to analyze your case in detail I will need the following information from you: Error screenshot The name of the champagne you have attended Your Huawei Id Service country We would greatly appreciate your feedback regarding our email exchange, as we need your input to keep improving our service. Therefore, we invite you to fill in the survey that will soon arrive on the email address you used to contact us. If you have any further questions, please feel free to reply to this email thread and we will be happy to walk you through your doubts. Sincerely, Silvia *****(PERSON) Customer Support team *****(PERSON) SE is a company incorporated under the laws of Ireland with its headquarters in Dublin, Ireland. *****(PERSON) SE is the provider of Huawei Mobile Services to Huawei and Honor device owners in *****(LOC), Canada, Australia, New Zealand and other countries. From : xxxxx@xxxx.com Sent : Tuesday 06 September *****(PHONE) 12:17 To : xxxxx@xxxx.com Subject : *****(PERSON) Support issue submit Product: AppGallery & Games Requests: Using AppGallery (i.e. manage service country) Contact Full Name: Inês Lavrador Ramos Phone Number: +*****(PHONE) Contact Email Address: xxxxx@xxxx.com Summary of the issue: Good morning! I would like to know how I can use a voucher that I won on app gallery since the store now was put together with other store, and I still have the voucher to use! thanks in advance! Home | News | Events | Products | Partners | Support Copyright *****(PERSON) SE *****(PHONE) *****(PHONE)","AppGallery /  Information request (e.g. prize delivery timeframe, how to join campaign)",AppGallery ,Suggestion,VIP / Offers / Promotions,Offers / Vouchers / Promotions,,AppGallery ,Suggestion,VIP / Offers / Promotions,Offers / Vouchers / Promotions,"I have to an account there? also I don't speak german! escreveu no dia quinta, 8/09/*****(PHONE) à(s) 12:08: Sehr geehrter Kunde, wir empfehlen Ihnen, uns über den Discord-Kanal https://discord.gg/tkYZC5CAGu direkt von Ihrem Computer aus zu kontaktieren. *****(PERSON) haben, Discord zu benutzen, oder wenn Sie es vorziehen, dass wir den Fall bearbeiten, geben Sie uns bitte folgende Informationen für weitere Untersuchungen: - Ihr Dienstland AppGallery> Ich> Einstellungen> Land - Ihre Discord-Kontaktinformationen, falls zutreffend Wenn Sie weitere Fragen haben, antworten Sie bitte auf diesen e-Mail und wir helfen Ihnen gerne bei Ihren Zweifeln weiter. *****(PERSON), Andrea *****(PERSON) Customer Support team *****(PERSON) SE is a company incorporated under the laws of Ireland with its headquarters in Dublin, Ireland. *****(PERSON) SE is the provider of Huawei Mobile Services to Huawei and Honor device owners in *****(LOC), Canada, Australia, New Zealand and other countries. From : xxxxx@xxxx.com Sent : Thursday 08 September *****(PHONE) 12:20 To : xxxxx@xxxx.com Subject : Re: RE : *****(PERSON) Support issue submit Hello , good morning! So the campaign name was ""XMAS download and win play PT"" as you will see in the screenshot I will send you, and I won a voucher to use it in a online store called ""*****(PERSON)"" but now ""*****(PERSON)"" is a part of other company/store called ""*****(PERSON)"" And what's my Huawei I'd service country? Thanks in advance! A ter, 6 de set de *****(PHONE), 12:16, < xxxxx@xxxx.com> escreveu: Dear Customer, Thank you for contacting *****(PERSON). We hope you’re doing well. This email is regarding your concern about *****(PERSON) worry I will do my best to solve your problem as soon as possible. In order to analyze your case in detail I will need the following information from you: Error screenshot The name of the champagne you have attended Your Huawei Id Service country We would greatly appreciate your feedback regarding our email exchange, as we need your input to keep improving our service. Therefore, we invite you to fill in the survey that will soon arrive on the email address you used to contact us. If you have any further questions, please feel free to reply to this email thread and we will be happy to walk you through your doubts. Sincerely, Silvia *****(PERSON) Customer Support team *****(PERSON) SE is a company incorporated under the laws of Ireland with its headquarters in Dublin, Ireland. *****(PERSON) SE is the provider of Huawei Mobile Services to Huawei and Honor device owners in *****(LOC), Canada, Australia, New Zealand and other countries. From : xxxxx@xxxx.com Sent : Tuesday 06 September *****(PHONE) 12:17 To : xxxxx@xxxx.com Subject : *****(PERSON) Support issue submit Product: AppGallery & Games Requests: Using AppGallery (i.e. manage service country) Contact Full Name: Inês Lavrador Ramos Phone Number: +*****(PHONE) Contact Email Address: xxxxx@xxxx.com Summary of the issue: Good morning! I would like to know how I can use a voucher that I won on app gallery since the store now was put together with other store, and I still have the voucher to use! thanks in advance! Home | News | Events | Products | Partners | Support Copyright *****(PERSON) SE *****(PHONE) *****(PHONE)",Suggestion,Re: RE : Aspiegel Support issue submit,,have to an account there also don speak german escreveu no dia quinta sehr geehrter kunde wir empfehlen ihnen uns ber den discord kanal https discord gg tkyzc cagu direkt von ihrem computer aus zu kontaktieren haben discord zu benutzen oder wenn sie es vorziehen dass wir den fall bearbeiten geben sie uns bitte folgende informationen r weitere untersuchungen ihr dienstland appgallery ich einstellungen land ihre discord kontaktinformationen falls zutreffend wenn sie weitere fragen haben antworten sie bitte auf diesen mail und wir helfen ihnen gerne bei ihren zweifeln weiter andrea to support issue submit so the campaign name was xmas download and win play pt as you will see in the screenshot will send you and won voucher to use it in online store called but now is part of other company store called and what my huawei d service country thanks in advance ter de set de escreveu we hope you re doing well this email is regarding your concern about worry will do my best to solve your problem as soon as possible in order to analyze your case in detail will need the following information from you error screenshot the name of the champagne you have attended your huawei id service country we would greatly appreciate your feedback regarding our email exchange as we need your input to keep improving our service therefore we invite you to fill in the survey that will soon arrive on the email address you used to contact us if you have any further questions please feel free to reply to this email thread and we will be happy to walk you through your doubts sincerely silvia to support issue submit product appgallery games requests using appgallery e manage service country contact full name in lavrador ramos phone numbe contact email address sum of the issue would like to know how can use voucher that won on app gallery since the store now was put together with other store and still have the voucher to use thanks in advance home news events products partners support copyright se
